English,Hindi
It looks like snow.,ऐसा लगता है कि बर्फ गिरने वाली है।
It started to snow.,बर्फ गिरने लगी।
It was sort of fun.,यह कुछ मजेदार था।
"It's mine, not his.","यह मेरा है, उसका नहीं।"
"It's mine, not his.","यह मेरा है, उसका नहीं।"
It's too expensive!,यह बहुत महंगा है!
It's too expensive!,यह बहुत महंगा है!
It's very hot here.,यहाँ बहुत गर्मी है।
Let me handle this.,मुझे यह संभालने दो।
Let's take a train.,चलो ट्रेन लेते हैं।
My car is a Toyota.,मेरी कार टोयोटा है।
My family is small.,मेरा परिवार छोटा है।
My wife is Chinese.,मेरी पत्नी चीनी है।
My wife is Chinese.,मेरी पत्नी चीनी है।
No one can help me.,कोई मेरी मदद नहीं कर सकता।
She is very pretty.,वह बहुत सुंदर है।
She leaped for joy.,वह खुशी से उछल पड़ी।
She smiled happily.,वह खुशी से मुस्कुराई।
She's not a doctor.,वह डॉक्टर नहीं है।
That guy annoys me.,वह आदमी मुझे परेशान करता है।
The batter was out.,बल्लेबाज आउट हो गया।
The crow flew away.,कौआ उड़ गया।
The power went out.,बिजली चली गई।
These dogs are big.,ये कुत्ते बड़े हैं।
This is Mary's dog.,यह मेरी है।
Was his story true?,क्या उसकी कहानी सच थी?
We are against war.,हम युद्ध के खिलाफ हैं।
We are against war.,हम युद्ध के खिलाफ हैं।
We enjoyed skating.,हमने स्केटिंग का आनंद लिया।
We were in a hurry.,हम जल्दी में थे।
We were very tired.,हम बहुत थक गए थे।
We're good friends.,हम अच्छे दोस्त हैं।
What a big pumpkin!,क्या बड़ा कद्दू है!
What's the problem?,समस्या क्या है?
When does it begin?,यह कब शुरू होगा?
Where are the kids?,बच्चे कहाँ हैं?
Where is the beach?,समुद्र तट कहाँ है?
Which dog is yours?,कौन सा कुत्ता तुम्हारा है?
Who broke the vase?,किसने फूलदान तोड़ा?
Who made this cake?,किसने यह केक बनाया?
Who's at the wheel?,कौन पहिये पर है?
Whose book is this?,यह किसकी किताब है?
You may use my pen.,तुम मेरा पेन इस्तेमाल कर सकते हो।
Answer my questions.,मेरे सवालों का जवाब दो।
Are they in the gym?,क्या वे जिम में हैं?
Can you drive a car?,क्या तुम कार चला सकते हो?
Can you drive a car?,क्या तुम कार चला सकते हो?
Could you sign here?,क्या आप यहां साइन कर सकते हैं?
Everybody likes her.,सभी उसे पसंद करते हैं।
Everybody likes him.,सभी उसे पसंद करते हैं।
"Excuse me, I'm lost.","मुझे माफ करना, मैं खो गया हूँ।"
He called me a taxi.,उसने मुझे टैक्सी बुलवाई।
He felt very lonely.,वह बहुत अकेला महसूस कर रहा था।
He lives next to me.,वह मेरे बगल में रहता है।
He looks very tired.,वह बहुत थका हुआ दिखता है।
He seems to be rich.,वह अमीर लगता है।
He'll get well soon.,वह जल्द ही ठीक हो जाएगा।
He's in a bad state.,वह बुरी स्थिति में है।
How about the taste?,स्वाद के बारे में क्या?
How did you make it?,आपने इसे कैसे बनाया?
I am not from India.,मैं भारत से नहीं हूँ।
I am reading a book.,मैं किताब पढ़ रहा हूँ।
I bought an old car.,मैंने पुरानी कार खरीदी।
I can teach English.,मैं अंग्रेजी पढ़ा सकता हूँ।
I continued singing.,मैं गाना गाना जारी रखता हूँ।
I do not understand.,मुझे समझ नहीं आता।
I don't like summer.,मुझे गर्मी पसंद नहीं है।
I forgot to ask him.,मैं उससे पूछना भूल गया।
I hate taking risks.,मुझे जोखिम लेना पसंद नहीं है।
I haven't eaten yet.,मैंने अभी तक नहीं खाया है।
I know both of them.,मुझे दोनों का पता है।
I know what that is.,मुझे पता है कि यह क्या है।
I tried to tell you.,मैंने आपको बताने की कोशिश की।
I want to marry her.,मैं उससे शादी करना चाहता हूँ।
I wanted her to win.,मैं चाहता था कि वह जीते।
I'd like a city map.,मुझे शहर का नक्शा चाहिए।
I'd like to see her.,मैं उससे मिलना चाहता हूँ।
I'd like to see her.,मैं उससे मिलना चाहता हूँ।
I'll be back at ten.,मैं दस बजे लौटूंगा।
I'll bring the wine.,मैं शराब लाऊंगा।
I'll bring the wine.,मैं शराब लाऊंगा।
I'll make you happy.,मैं तुम्हें खुश कर दूंगा।
I've already called.,मैंने पहले ही कॉल कर लिया है।
I've lost my ticket.,मैंने अपना टिकट खो दिया है।
Let's play baseball!,चलो बेसबॉल खेलते हैं!
Must I write in ink?,क्या मुझे स्याही में लिखना चाहिए?
My family loved Tom.,मेरा परिवार टॉम से प्यार करता था।
My money was stolen.,मेरा पैसा चोरी हो गया।
My sister has a job.,मेरी बहन के पास नौकरी है।
She kept on working.,वह काम करती रही।
She pulled my shirt.,उसने मेरी शर्ट खींची।
That is not a tiger.,वह बाघ नहीं है।
That was my mistake.,वह मेरी गलती थी।
The skies are clear.,आसमान साफ है।
The trees are green.,पेड़ हरे हैं।
These are our books.,ये हमारी किताबें हैं।
This is what I need.,यह वही है जो मुझे चाहिए।
Watch your language.,अपनी भाषा पर ध्यान दें।